{
  "authorization_record_refs": [
    "agent-exchange/decisions/2026-09-02T162000Z-human-d9-final-dataset-construction-authorization-gc-30m-f9d3c1b0.md"
  ],
  "blocked_actions": [
    "MODEL_PROMOTION",
    "LIVE_TRADING",
    "BROKER_EXECUTION",
    "CAPITAL_ALLOCATION",
    "CLAIM_EDGE"
  ],
  "builder_version": "gc-30m-real-dataset-builder-0.1.0",
  "contract_identity_status": "UNDECLARED_PENDING_RESEARCH",
  "contract_version": "gc-atr14-1r-1r-8bar-zero-cost-0.1.0",
  "created_at": "2026-09-07T12:55:52.234702Z",
  "dataset_id": "f9d3c1b0d02da255a89dcbd01033106c51da389e25bb38f3307b9b1dc0c6e966",
  "dataset_name": "gc-30m-real-research-dataset",
  "feature_schema_version": "gc-30m-real-feature-schema-0.1.0",
  "identity_manifest_id": "ce3be8b21feb3702fbcd98377719b4b9314493ebd3313b93eff0b06fbada4171",
  "identity_source": "LOCAL_ARCHIVE_VERIFIED",
  "label_version": "gc-outcome-contract-label-0.1.0",
  "manifest_id": "aecfdbfbb6f30c7f4e1666d8ed92a6646bef2d4a818dc58e9f751167c8de883e",
  "manifest_version": "gc-30m-real-dataset-build-manifest-0.1.0",
  "mode": "GC_REAL_DATASET_BUILD",
  "model_promotion_allowed": false,
  "ohlcv_source_stats": {
    "bars_30m_with_data": 191521,
    "members_read": 195,
    "source_rows_1s": 104212803
  },
  "order_flow_source_stats": {
    "bars_30m_with_order_flow": 183968,
    "member": "gc/GCext_of_1m.parquet",
    "source_rows_1m": 5388775
  },
  "real_dataset_built": true,
  "rows_columns": [
    "dataset_id",
    "dataset_version",
    "bar_start",
    "bar_end",
    "trade_date",
    "session_seq",
    "direction",
    "open",
    "high",
    "low",
    "close",
    "volume",
    "seconds_with_trades",
    "atr_14",
    "ret_1",
    "ret_4",
    "ret_8",
    "ret_14",
    "range_over_atr",
    "volume_30m",
    "of_volume",
    "of_delta",
    "of_trades",
    "of_minutes_present",
    "of_volume_sum_14",
    "of_delta_sum_14",
    "of_trades_sum_14",
    "entry_price",
    "risk_r",
    "target_price",
    "stop_price",
    "outcome_class",
    "time_to_outcome_bars",
    "net_return_r",
    "split",
    "exclusion_reasons_ohlcv_only",
    "exclusion_reasons_order_flow",
    "included_ohlcv_only",
    "included_order_flow",
    "label_quality",
    "candidate_id"
  ],
  "rows_count": 380362,
  "rows_file": "rows.parquet",
  "rows_relative_dir": "f9d3c1b0d02da255",
  "rows_sha256": "6b5045fbfff060748aae1e39d93308d801f35afacb0a6c8f46d466a45b77d0a0",
  "source_hashes": {
    "ohlcv_1s_zip": "b59a9dd08a317162024d53c4f0841a68d68e51dfb66f5d9d62b140304c24c3d1",
    "order_flow_zip": "34f82b1b9306f3605b00d60bcb96cb4aa0fc74c5de1f2d2401d1c1d610f03155"
  },
  "summary": {
    "expected_session_bars": 194028,
    "first_bar_start": "2010-06-07T00:00:00Z",
    "last_bar_start": "2026-08-05T23:30:00Z",
    "missing_expected_bars": 3847,
    "missing_expected_bars_by_split": {
      "TEST": 535,
      "TRAIN": 2981,
      "VALIDATION": 331
    },
    "missing_expected_bars_by_trade_date": {
      "2010-07-02": 1,
      "2010-07-05": 7,
      "2010-07-30": 2,
      "2010-09-03": 1,
      "2010-09-06": 7,
      "2010-10-08": 1,
      "2010-11-24": 1,
      "2010-11-25": 7,
      "2010-11-26": 6,
      "2010-12-24": 46,
      "2010-12-31": 1,
      "2011-01-14": 1,
      "2011-01-17": 7,
      "2011-02-21": 7,
      "2011-04-22": 46,
      "2011-05-30": 7,
      "2011-07-04": 7,
      "2011-09-05": 7,
      "2011-11-24": 7,
      "2011-11-25": 6,
      "2011-12-26": 46,
      "2012-01-02": 46,
      "2012-01-16": 7,
      "2012-02-01": 1,
      "2012-02-20": 7,
      "2012-04-06": 46,
      "2012-05-28": 7,
      "2012-05-31": 1,
      "2012-06-01": 2,
      "2012-07-04": 7,
      "2012-07-31": 1,
      "2012-09-03": 7,
      "2012-09-12": 46,
      "2012-11-22": 46,
      "2012-11-23": 6,
      "2012-12-24": 6,
      "2012-12-25": 46,
      "2013-01-01": 46,
      "2013-01-21": 46,
      "2013-02-18": 46,
      "2013-03-29": 46,
      "2013-05-27": 46,
      "2013-07-04": 46,
      "2013-08-01": 1,
      "2013-09-02": 46,
      "2013-11-28": 46,
      "2013-11-29": 6,
      "2013-12-24": 6,
      "2013-12-25": 46,
      "2014-01-01": 46,
      "2014-01-20": 46,
      "2014-02-17": 46,
      "2014-04-18": 46,
      "2014-05-26": 8,
      "2014-06-13": 45,
      "2014-07-04": 8,
      "2014-08-01": 1,
      "2014-08-25": 8,
      "2014-09-01": 8,
      "2014-09-23": 46,
      "2014-09-24": 46,
      "2014-09-25": 46,
      "2014-09-26": 26,
      "2014-11-27": 8,
      "2014-11-28": 6,
      "2014-12-24": 6,
      "2014-12-25": 46,
      "2014-12-31": 46,
      "2015-01-01": 46,
      "2015-01-19": 8,
      "2015-02-16": 8,
      "2015-03-31": 1,
      "2015-04-01": 3,
      "2015-04-03": 46,
      "2015-05-25": 8,
      "2015-05-29": 1,
      "2015-07-01": 5,
      "2015-07-03": 8,
      "2015-09-07": 8,
      "2015-11-26": 8,
      "2015-11-27": 6,
      "2015-12-24": 6,
      "2015-12-25": 46,
      "2016-01-01": 46,
      "2016-01-18": 8,
      "2016-02-15": 8,
      "2016-03-25": 46,
      "2016-05-30": 8,
      "2016-07-04": 8,
      "2016-07-29": 1,
      "2016-09-05": 8,
      "2016-11-24": 8,
      "2016-11-25": 6,
      "2016-12-26": 46,
      "2017-01-02": 46,
      "2017-01-16": 8,
      "2017-02-01": 1,
      "2017-02-20": 8,
      "2017-04-14": 46,
      "2017-05-29": 8,
      "2017-06-01": 1,
      "2017-07-04": 8,
      "2017-09-04": 8,
      "2017-11-23": 8,
      "2017-11-24": 6,
      "2017-11-30": 2,
      "2017-12-01": 1,
      "2017-12-25": 46,
      "2018-01-01": 46,
      "2018-01-15": 8,
      "2018-01-31": 2,
      "2018-02-19": 8,
      "2018-03-30": 46,
      "2018-04-30": 1,
      "2018-05-28": 8,
      "2018-05-31": 2,
      "2018-06-01": 4,
      "2018-07-04": 8,
      "2018-07-31": 3,
      "2018-08-01": 1,
      "2018-09-03": 8,
      "2018-11-22": 8,
      "2018-11-23": 6,
      "2018-11-30": 4,
      "2018-12-24": 6,
      "2018-12-25": 46,
      "2019-01-01": 46,
      "2019-01-21": 8,
      "2019-01-31": 2,
      "2019-02-01": 1,
      "2019-02-18": 8,
      "2019-02-27": 5,
      "2019-03-29": 1,
      "2019-04-19": 46,
      "2019-05-27": 8,
      "2019-07-04": 8,
      "2019-07-31": 2,
      "2019-09-02": 8,
      "2019-11-28": 8,
      "2019-11-29": 7,
      "2019-12-24": 6,
      "2019-12-25": 46,
      "2020-01-01": 46,
      "2020-01-20": 8,
      "2020-01-31": 3,
      "2020-02-17": 8,
      "2020-02-27": 10,
      "2020-02-28": 46,
      "2020-04-10": 46,
      "2020-05-25": 8,
      "2020-05-29": 2,
      "2020-06-30": 13,
      "2020-07-01": 4,
      "2020-07-03": 8,
      "2020-07-31": 4,
      "2020-09-07": 8,
      "2020-11-26": 8,
      "2020-11-27": 6,
      "2020-12-24": 6,
      "2020-12-25": 46,
      "2021-01-01": 46,
      "2021-01-18": 8,
      "2021-01-29": 6,
      "2021-02-15": 8,
      "2021-03-31": 2,
      "2021-04-02": 46,
      "2021-05-28": 2,
      "2021-05-31": 8,
      "2021-07-05": 8,
      "2021-07-30": 4,
      "2021-09-06": 8,
      "2021-11-25": 8,
      "2021-11-26": 6,
      "2021-11-30": 3,
      "2021-12-01": 1,
      "2021-12-24": 46,
      "2022-01-17": 5,
      "2022-02-21": 5,
      "2022-03-31": 1,
      "2022-04-15": 46,
      "2022-05-30": 5,
      "2022-06-20": 5,
      "2022-07-04": 5,
      "2022-07-29": 1,
      "2022-09-05": 5,
      "2022-11-24": 5,
      "2022-11-25": 6,
      "2022-11-30": 5,
      "2022-12-01": 1,
      "2022-12-26": 46,
      "2023-01-02": 46,
      "2023-01-16": 5,
      "2023-01-31": 1,
      "2023-02-01": 1,
      "2023-02-20": 5,
      "2023-03-31": 1,
      "2023-04-07": 46,
      "2023-05-29": 5,
      "2023-05-31": 5,
      "2023-06-19": 5,
      "2023-07-04": 5,
      "2023-07-31": 2,
      "2023-09-04": 5,
      "2023-11-23": 5,
      "2023-11-24": 6,
      "2023-12-25": 46,
      "2024-01-01": 46,
      "2024-01-15": 5,
      "2024-01-31": 1,
      "2024-02-19": 5,
      "2024-03-28": 1,
      "2024-03-29": 46,
      "2024-05-27": 5,
      "2024-05-31": 1,
      "2024-06-19": 5,
      "2024-07-04": 5,
      "2024-07-31": 1,
      "2024-09-02": 5,
      "2024-11-28": 12,
      "2024-11-29": 4,
      "2024-12-24": 6,
      "2024-12-25": 46,
      "2025-01-01": 46,
      "2025-01-20": 5,
      "2025-01-31": 1,
      "2025-02-17": 5,
      "2025-04-18": 46,
      "2025-05-26": 5,
      "2025-05-30": 2,
      "2025-06-19": 5,
      "2025-07-04": 8,
      "2025-07-31": 1,
      "2025-09-01": 5,
      "2025-11-27": 5,
      "2025-11-28": 25,
      "2025-12-24": 6,
      "2025-12-25": 46,
      "2026-01-01": 46,
      "2026-01-19": 5,
      "2026-01-30": 1,
      "2026-02-16": 5,
      "2026-02-25": 2,
      "2026-04-03": 46,
      "2026-05-25": 5,
      "2026-06-19": 8,
      "2026-07-03": 8,
      "2026-07-30": 1,
      "2026-07-31": 4
    },
    "out_of_session_bars_with_data": 1340,
    "present_session_bars": 190181,
    "rows_by_split": {
      "TEST": 61312,
      "TRAIN": 271870,
      "VALIDATION": 47180
    },
    "rows_total": 380362,
    "rules": {
      "atr_bars": 14,
      "atr_method": "SIMPLE_MEAN_TRUE_RANGE",
      "available_at": "BAR_END_UTC",
      "bar_minutes": 30,
      "builder_version": "gc-30m-real-dataset-builder-0.1.0",
      "calendar_id": "cme-globex-metals-research-v1",
      "contract_version": "gc-atr14-1r-1r-8bar-zero-cost-0.1.0",
      "directions": [
        "LONG",
        "SHORT"
      ],
      "embargo_bars": 8,
      "entry": "NEXT_BAR_OPEN_AFTER_DECISION_BAR_CLOSE",
      "feature_lookback_bars": 15,
      "feature_schema_version": "gc-30m-real-feature-schema-0.1.0",
      "fill_truth": "ZERO_COST_RESEARCH_SIMULATOR_ONLY_NOT_EXECUTION_TRUTH",
      "horizon_bars": 8,
      "interval_semantics": "HALF_OPEN_UTC_START_INCLUSIVE_END_EXCLUSIVE",
      "label_version": "gc-outcome-contract-label-0.1.0",
      "ohlcv_features": [
        "close",
        "atr_14",
        "ret_1",
        "ret_4",
        "ret_8",
        "ret_14",
        "range_over_atr",
        "volume_30m",
        "seconds_with_trades"
      ],